Catchphrase,Characterization Marches On,Comically Missing the Point,Couch Gag,Disproportionate Retribution,Establishing Character Moment,Imagine Spot,Karma Houdini,Running Gag,Special Guest,Trope Description,Text Length,lemma
0.0,0.0,0.0,0.0,0.0,0.0,1.0,0.0,0.0,0.0, Okay Ralphie You win this time But well be backElliot JD be sensitive Dont act like youre at a pingpong match between a ninja and Bigfoot Dr Kelso gives Elliot an odd look Elliot I know that made no sense but hes totally there now in his head Look at his eyes JDs eyes dart back and forth Dr Kelso Look at that— ScrubsA brief cut to a Fantasy Sequence and back usually no more than a few seconds long and commonly bookended by a Fade to White Alice yells at Bob What am I your maid Cut to Alice cleaning the house in a French Maid Outfit Cut to Bobs face — hes clearly just imagined the role and Alice has just slapped him to wake him up back to realityA very popular trope with commercials so much so that it could almost be considered an advertising trope as much as it is a comedy trope with the idea being to either convey how much ones life would be better with the productservice or how easily obtainable it is,917,okay ralphie you win this time but well be backelliot jd be sensitive dont act like youre at a pingpong match between a ninja and bigfoot dr kelso give elliot an odd look elliot i know that make no sense but he totally there now in his head look at his eye jds eye dart back and forth dr kelso look at that— scrubsa brief cut to a fantasy sequence and back usually no more than a few second long and commonly bookended by a fade to white alice yell at bob what be i your maid cut to alice cleaning the house in a french maid outfit cut to bob face — he clearly just imagine the role and alice have just slap him to wake him up back to realitya very popular trope with commercial so much so that it could almost be consider an advertising trope a much a it be a comedy trope with the idea be to either convey how much one life would be well with the productservice or how easily obtainable it be
0.0,0.0,0.0,1.0,0.0,0.0,0.0,0.0,0.0,0.0,After seven seasons weve pretty much said everything you can say in this spot— Garfield Garfield and Friends Arbuckle the InvincibleThe Monster Who Couldnt Scare AnybodyThe Ocean BlueA trope throughout a series by which a part of the opening or ending credits is interchangeably switched and the content can be different every show Some of the same shows also have couch gags at the end as a Credits Gag Alternatively this gag may occur at the end of The Teaser just before the credits startNamed for one of its bestknown incarnations the family scrambling to gather on the couch during the opening sequence of The SimpsonsNote that it need not be a gag TV dramas such as Mission Impossible and Justice League Unlimited will sometimes have clips from later in the episodeCompare to Different in Every Episode Not to be confused with the other type of couch and gag,864,after seven season weve pretty much say everything you can say in this spot— garfield garfield and friend arbuckle the invinciblethe monster who couldnt scare anybodythe ocean bluea trope throughout a series by which a part of the opening or end credit be interchangeably switch and the content can be different every show some of the same show also have couch gag at the end a a credit gag alternatively this gag may occur at the end of the teaser just before the credit startnamed for one of it bestknown incarnation the family scramble to gather on the couch during the opening sequence of the simpsonsnote that it need not be a gag tv drama such a mission impossible and justice league unlimited will sometimes have clip from later in the episodecompare to different in every episode not to be confuse with the other type of couch and gag
1.0,0.0,0.0,0.0,0.0,0.0,0.0,0.0,0.0,0.0,Catchphrase may refer to one of the following Character Catchphrase A phrase a character repeats multiple times in an identifiable way Index of Catchphrases Tropes that depict different types of catchphrases and the ways characters use them Catchphrase A 1980s Game Show Catch Phrase 1994 A board game from Parker BrothersIf a direct wick has led you here please correct the link so that it points to the corresponding articleImportant LinksAdvertisementTVTropes is licensed under a Creative Commons AttributionNonCommercialShareAlike 30 Unported License Permissions beyond the scope of this license may be available from  thestafftvtropesorg,642,catchphrase may refer to one of the follow character catchphrase a phrase a character repeat multiple time in an identifiable way index of catchphrase trope that depict different type of catchphrase and the way character use them catchphrase a 1980s game show catch phrase 1994 a board game from parker brothersif a direct wick have lead you here please correct the link so that it point to the correspond articleimportant linksadvertisementtvtropes be license under a creative common attributionnoncommercialsharealike 30 unported license permission beyond the scope of this license may be available from thestafftvtropesorg
0.0,0.0,1.0,0.0,0.0,0.0,0.0,0.0,0.0,0.0,I started to walk down the street when I heard a voice saying Good evening Mr Dowd I turned and there was this big white rabbit leaning against a lamppost Well I thought nothing of that because when youve lived in a town as long as Ive lived in this one you get used to the fact that everybody knows your name— Elwood P Dowd HarveyA character completely misses a really obvious point for comic effect The point is the sort of thing that any reasonable or informed person will spot and understand given a few seconds or enough information However the center of this trope is a person who despite having all the time in the world and all the information comes to a conclusion so wrong its hard to be even further from correct Commonly elicits a response along the lines of thats not whats wrong here Visual gags are often involvedA Sister Trope to Dramatically Missing the PointCompare Alternative Joke Interpretation Are You Pondering What Im Pondering Bad News in a Good Way BaitandSwitch Comment Cloudcuckoolander The Ditz Failed a Spot Check Insane Troll Logic logic that consists of comically missing the point I Take Offense to That Last One Mistaken for Profound Need a Hand or a Handjob Not Actually the Ultimate Question Proportional Article Importance Right for the Wrong Reasons Sidetracked by the Analogy and Skewed PrioritiesInUniverse Examples Only Well have to spend a lot of money just to make another subpage for real life  Note The actual reason being that its too common and attracts natter,1507,i start to walk down the street when i heard a voice say good even mr dowd i turn and there be this big white rabbit lean against a lamppost well i thought nothing of that because when youve live in a town a long a ive live in this one you get use to the fact that everybody know your name— elwood p dowd harveya character completely miss a really obvious point for comic effect the point be the sort of thing that any reasonable or inform person will spot and understand give a few second or enough information however the center of this trope be a person who despite have all the time in the world and all the information come to a conclusion so wrong it hard to be even far from correct commonly elicits a response along the line of thats not whats wrong here visual gag be often involveda sister trope to dramatically miss the pointcompare alternative joke interpretation be you ponder what im ponder bad news in a good way baitandswitch comment cloudcuckoolander the ditz fail a spot check insane troll logic logic that consists of comically miss the point i take offense to that last one mistaken for profound need a hand or a handjob not actually the ultimate question proportional article importance right for the wrong reason sidetrack by the analogy and skewed prioritiesinuniverse example only well have to spend a lot of money just to make another subpage for real life note the actual reason be that it too common and attracts natter
0.0,0.0,0.0,0.0,0.0,0.0,0.0,0.0,1.0,0.0,Thats not a running gag Thats a pun Its a running gag nowKermit the Frog No Fozzie Do not answer that telephone Fozzie Bear But Kermit all these terrific funny things happen when I do answer it Kermit Im aware of that Im aware of that Fozzie Is there no end to this running gag Animal runs in and rips the phone off the wall before carrying it away Fozzie Well I guess that puts an end to this running gag Kermit Yeah and also to all the incoming calls— The Muppet ShowA joke whose humor derives from repetition ideally becoming funnier each time it is repeated Must be repeated at least three times otherwise its a Brick Joke or Chekhovs Gag Common variants are a joke that occurs Once an Episode and a joke that goes on for long enough that it becomes an OverlyLong Gag but not so long that it loses its humorThe ultimate fear for the use of any running gag is that doing it too often threatens to turn it into an Overused Running Gag or worse it was never funny in the first place and didnt improve through repetition Nothing is worse than starting a one hour show with a joke that bombs the first time and reappears twenty more times over the next hourA Running Gag can be limited to a particular episode or recur throughout an entire series If it recurs throughout an entire series then it will often develop variations andor be accompanied by Lampshade Hanging If a character breaks the fourth wall to mention it its Didnt We Use This Joke Already When the story goes on to kill off the gag for good either with a final payoff or just by referencing that its become too overused and its ending right then that is Running Gagged,1633,thats not a run gag thats a pun it a run gag nowkermit the frog no fozzie do not answer that telephone fozzie bear but kermit all these terrific funny thing happen when i do answer it kermit im aware of that im aware of that fozzie be there no end to this run gag animal run in and rip the phone off the wall before carry it away fozzie well i guess that put an end to this run gag kermit yeah and also to all the incoming calls— the muppet showa joke whose humor derives from repetition ideally become funnier each time it be repeat must be repeat at least three time otherwise it a brick joke or chekhov gag common variant be a joke that occurs once an episode and a joke that go on for long enough that it becomes an overlylong gag but not so long that it loses it humorthe ultimate fear for the use of any run gag be that do it too often threatens to turn it into an overuse run gag or bad it be never funny in the first place and didnt improve through repetition nothing be bad than start a one hour show with a joke that bomb the first time and reappears twenty more time over the next houra run gag can be limited to a particular episode or recur throughout an entire series if it recurs throughout an entire series then it will often develop variation andor be accompany by lampshade hang if a character break the fourth wall to mention it it didnt we use this joke already when the story go on to kill off the gag for good either with a final payoff or just by reference that it become too overuse and it end right then that be run gag
0.0,0.0,0.0,0.0,1.0,0.0,0.0,0.0,0.0,0.0,But that was two years agoRevenge is a dish best served with an extra helping— Captain Young Troops of DoomIn some situations it makes sense to let the opponent know that if they so much as sneeze on someone you protect it will cost them a limb If you have tried an eye for an eye and it really didnt do anything except help sell eyepatches the only way to stay alive is to be drastic Pay back any offense tenfold or even a hundredfold if necessary until the survivors learn to stay away andor do everything in their power to keep you in a good mood Its a common tactic of militaries the world over with some regimes such as Nazi Germany being infamous for itThat said the Justice these rivals have in mind is more akin to a brutal beatdown well most of the time it is an actual brutal NoHoldsBarred Beatdown supposed to culminate in the receivers humiliation or death Any attempt to get them to see the all too obvious truth show mercy or realize theyre a step away from utterly ruining the receivers lifecommitting murder will never succeed It invariably takes the hero beating the rival be it in a Cooking Duel or Good Old Fisticuffs and proving Right Makes Might for the poor deluded soul to realize they were wrong all along sometimes even coming around and realizing that Defeat Means FriendshipVillains who claim that their bad pastcircumstances led them to do this will likely make you realize that Freudian Excuse Is No ExcuseAll too often these guys refuse to see reason They promise that theyll come back to kill the hero and shove his mercy and offer of friendship down his wind pipe It might take the arrival of a plot significant character to clear things up and hand out some Epiphany Therapy to all involvedThis is not limited to the antagonists side God help you if that hero youve harmed has a Psycho Supporter And all parties to a masquerade good or bad are often required to kill any poor schmuck who accidentally sees something hes not supposed toThis could be what stops something from being an act of justice instead of an act of vengeance May be used as part of Cruel Mercy A common habit for Lawful Stupid charactersIntriguingly while disproportionate can possibly mean underdoing it youll almost never see that happen,2243,but that be two year agorevenge be a dish best serve with an extra helping— captain young troop of doomin some situation it make sense to let the opponent know that if they so much a sneeze on someone you protect it will cost them a limb if you have try an eye for an eye and it really didnt do anything except help sell eyepatch the only way to stay alive be to be drastic pay back any offense tenfold or even a hundredfold if necessary until the survivor learn to stay away andor do everything in their power to keep you in a good mood it a common tactic of military the world over with some regime such a nazi germany be infamous for itthat say the justice these rival have in mind be more akin to a brutal beatdown well most of the time it be an actual brutal noholdsbarred beatdown suppose to culminate in the receiver humiliation or death any attempt to get them to see the all too obvious truth show mercy or realize theyre a step away from utterly ruin the receiver lifecommitting murder will never succeed it invariably take the hero beating the rival be it in a cooking duel or good old fisticuffs and prove right make might for the poor delude soul to realize they be wrong all along sometimes even come around and realize that defeat mean friendshipvillains who claim that their bad pastcircumstances lead them to do this will likely make you realize that freudian excuse be no excuseall too often these guy refuse to see reason they promise that theyll come back to kill the hero and shove his mercy and offer of friendship down his wind pipe it might take the arrival of a plot significant character to clear thing up and hand out some epiphany therapy to all involvedthis be not limited to the antagonist side god help you if that hero youve harm have a psycho supporter and all party to a masquerade good or bad be often require to kill any poor schmuck who accidentally see something he not suppose tothis could be what stop something from be an act of justice instead of an act of vengeance may be use a part of cruel mercy a common habit for lawful stupid charactersintriguingly while disproportionate can possibly mean underdoing it youll almost never see that happen
0.0,0.0,0.0,0.0,0.0,1.0,0.0,0.0,0.0,0.0,In just a handful of scenes weve established the full set of character archetypes to see us through until the series goes off air Zacks a huckster Slater a jock Jessie an uptight brain Kelly a cheerful object of desire and Screech an intolerable bundle of silly faces When Lisa appears on crutches having kicked a television in rage when her favorite nail polish was discontinued her core personality — likes clothes doesnt fancy Screech — is also laid out— Stuart Millard on the first episode of Saved by the BellFirst impressions count and in TV and film even more so theres no point in hiring an actor to give us a Deadpan Snarker if people think theyre seriously being a total ditz until the third act So when the character comes into the plot you give them an Establishing Character MomentThe establishing character moment does not have to be huge it doesnt have to be impressive it doesnt even have to be first Its about revealing a characters motivations and abilities in a single introductory scene They could blow the roof and rappel in from a helicopter with an automatic in each hand but if theyre The Woobie its not a good idea unless youre aiming for a Heartbroken Badass like Harry Dresden or SpiderManSometimes the first thing needed is to set up how they fit into the plot but this may not best reveal their character So the Establishing Character Moment may be one or two scenes down the line For TV shows and their episodic format the character may first do what they need to do in the episode and then near the end establish how the character will fit into the ongoing arcs and themes of the showOther times the Moment may be the small calm when the character carries out something completely unrelated to the plot to show them in their natural element before putting them in an unrelenting storm of plot lines — for instance during a Morning Routine sequenceWhen it happens it cannot be taken back A running punt to a puppy will completely color attempts to Pet the Dog later but if you start with a gentle stroke then some people may get the wrong idea about your villain Then again a Bait the Dog moment may subvert this or it might itself serve to show the complex multifaceted Hidden Depths of that characterIf this happens in a musical it can be in I Am Song formatSubtropes include BaitandSwitch Character Intro Bitch Alert Incoming Ham Newcomer Saves the Day and Reestablishing Character Moment See also Establishing Series Moment May overlap with AMFM Characterization Compare Characterisation Click Moment Contrast Establishing Team Shot when The Team is established,2597,in just a handful of scene weve establish the full set of character archetype to see u through until the series go off air zacks a huckster slater a jock jessie an uptight brain kelly a cheerful object of desire and screech an intolerable bundle of silly face when lisa appear on crutch have kick a television in rage when her favorite nail polish be discontinue her core personality — like clothes doesnt fancy screech — be also laid out— stuart millard on the first episode of save by the bellfirst impression count and in tv and film even more so there no point in hire an actor to give u a deadpan snarker if people think theyre seriously be a total ditz until the third act so when the character come into the plot you give them an establish character momentthe establish character moment do not have to be huge it doesnt have to be impressive it doesnt even have to be first it about reveal a character motivation and ability in a single introductory scene they could blow the roof and rappel in from a helicopter with an automatic in each hand but if theyre the woobie it not a good idea unless youre aim for a heartbroken badass like harry dresden or spidermansometimes the first thing need be to set up how they fit into the plot but this may not best reveal their character so the establish character moment may be one or two scene down the line for tv show and their episodic format the character may first do what they need to do in the episode and then near the end establish how the character will fit into the ongoing arc and theme of the showother time the moment may be the small calm when the character carry out something completely unrelated to the plot to show them in their natural element before put them in an unrelenting storm of plot line — for instance during a morning routine sequencewhen it happens it can not be take back a run punt to a puppy will completely color attempt to pet the dog later but if you start with a gentle stroke then some people may get the wrong idea about your villain then again a bait the dog moment may subvert this or it might itself serve to show the complex multifaceted hidden depth of that characterif this happens in a musical it can be in i be song formatsubtropes include baitandswitch character intro bitch alert incoming ham newcomer save the day and reestablish character moment see also establish series moment may overlap with amfm characterization compare characterisation click moment contrast establish team shot when the team be establish
